{
  "$schema": "compatibility-quirks-v1.schema.json",
  "schema_version": 1,
  "format": "capplusplus_compatibility_quirks",
  "baseline": "Known unmodified DOS 1.0 and Windows 1.0 Capitalism Plus builds",
  "catalog_status": "active",
  "entries": [
    {
      "id": "town_pointer_residue",
      "title": "Town records contain pointer-like runtime residue",
      "domain": "persistence",
      "status": "inferred",
      "affected_builds": [
        "dos_1_0",
        "windows_1_0"
      ],
      "observed_behavior": "Two 32-bit town-record fields differ across the matched DOS and Windows saves like transient runtime values. Their pointer interpretation remains inferred, and normalization is limited to the registered byte ranges.",
      "classic_policy": "sanitize",
      "extended_policy": "inherit",
      "risk": "data_integrity",
      "evidence": [
        "docs/formats.md#town-array-101b",
        "docs/validation.md#saves"
      ],
      "tests": [
        "tests/test_saves.py"
      ],
      "notes": "Original-save import may classify the registered bytes under the versioned normalization policy. Canonical runtime state and native saves must never store host pointers or object addresses."
    },
    {
      "id": "town_market_float_drift",
      "title": "Town market floats drift across builds",
      "domain": "simulation",
      "status": "confirmed",
      "affected_builds": [
        "dos_1_0",
        "windows_1_0"
      ],
      "observed_behavior": "The matched saves contain 370 changed values among four tracked float32 positions, and every changed value is one to four ULPs apart across the two builds.",
      "classic_policy": "pending",
      "extended_policy": "pending",
      "risk": "determinism",
      "evidence": [
        "docs/formats.md#cross-build-comparison",
        "docs/validation.md#saves"
      ],
      "tests": [
        "tests/test_saves.py"
      ],
      "notes": "The economic meanings and arithmetic path still need controlled probes. Choose a canonical result only after establishing whether the drift changes decisions."
    },
    {
      "id": "terrain_fertility_signed_char",
      "title": "Terrain fertility has a compiler signed-char divergence",
      "domain": "simulation",
      "status": "confirmed",
      "affected_builds": [
        "dos_1_0",
        "windows_1_0"
      ],
      "observed_behavior": "For a negative interior base-land fertility intermediate, the DOS path clamps to 100 while the Windows path clamps to 0 because the compiler-generated byte comparisons use different signedness.",
      "classic_policy": "pending",
      "extended_policy": "pending",
      "risk": "determinism",
      "evidence": [
        "docs/terrain.md#climate-rainfall-and-soil-fertility",
        "docs/validation.md#terrain-function-comparisons"
      ],
      "tests": [
        "tests/test_terrain.py"
      ],
      "notes": "The inspector exposes both original profiles. Measure the gameplay consequence before selecting the deterministic Classic rule."
    },
    {
      "id": "playing_time_62_second_minute",
      "title": "Playing-time display uses 62-second minutes",
      "domain": "presentation",
      "status": "confirmed",
      "affected_builds": [
        "dos_1_0",
        "windows_1_0"
      ],
      "observed_behavior": "Both original playing-time formatters divide accumulated seconds by 62 for minutes and by 3720 for hours, so one displayed minute lasts 62 real seconds.",
      "classic_policy": "pending",
      "extended_policy": "fix",
      "risk": "compatibility",
      "evidence": [
        "docs/simulation-clock.md#playing-time-display-quirk"
      ],
      "tests": [
        "tests/test_simulation.py"
      ],
      "notes": "Keep canonical accumulated playing time in seconds. The 62-second display was verified in historical DOS/Windows builds, not Steam 1.01; Classic's target behavior needs a Steam probe. Extended may use conventional 60-second minutes without changing saved time."
    }
  ]
}
